title,"MACCA C2 IC Optique"
meta,"Lunette  Optique MACCAC2 coloris ARGENT taille 47-19-145 matiere combinée"
title,"TURUNEN C1 VF Optique"
meta,"Lunette  Optique TURUNENC1 coloris ROUGE taille 51-15-140 matiere acétate"
title,"WELCH C4 VF Optique"
meta,"Lunette  Optique WELCHC4 coloris ROUGE taille 52-14-140 matiere acétate"
title,"WRETZKY C1 VF Optique"
meta,"Lunette  Optique WRETZKYC1 coloris NOIR taille 50-16-140 matiere acétate"
title,"WARD C1 VF OLYMPIA  Solaire"
meta,"Lunette  Solaire WARDC1 coloris NOIR taille 48-22-145 matiere combinée"
title,"WILLIAMS C1 VF Solaire"
meta,"Lunette  Solaire WILLIAMSC1 coloris NOIR taille 49-20-140 matiere acétate"
title,"TUNSTALL C1 VF Solaire"
meta,"Lunette  Solaire TUNSTALLC1 coloris melange taille 52-18-143 matiere acétate"
title,"TRUJILLO C1 VF OPTIQUE"
meta,"Lunette  Optique TRUJILLOC1 coloris melange taille 52-21-145 matiere acétate"
title,"WARWICK C1 VF Optique"
meta,"Lunette  Optique WARWICKC1 coloris melange taille 54-17-140 matiere acétate"
title,"WATANABE C1 VF OPTIQUE"
meta,"Lunette  Optique WATANABEC1 coloris melange taille 52-19-140 matiere combinée"
title,"BRAXTON C1 VF Optique"
meta,"Lunette  Optique BRAXTONC1 coloris melange taille 52-20-140 matiere metal"
title,"KESSLER C1 VF Optique"
meta,"Lunette  Optique KESSLERC1 coloris melange taille 52-20-140 matiere metal"
title,"STAHL C1 VF OPTIQUE"
meta,"Lunette  Optique STAHLC1 coloris melange taille 47-22-140 matiere metal"
title,"KANE  C1 VF Solaire"
meta,"Lunette  Solaire KANEC1 coloris melange taille 53-20-145 matiere metal"
title,"ARAYA C1 VF Optique"
meta,"Lunette  Solaire ARAYAC1 coloris GRIS taille 53-20-140 matiere acétate"
title,"ARAYA C2 VF Optique"
meta,"Lunette  Solaire ARAYAC2 coloris GRIS taille 53-20-140 matiere acétate"
title,"ARAYA C3 VF Optique"
meta,"Lunette  Solaire ARAYAC3 coloris GRIS taille  matiere acétate"
title,"BANHART C1 VF Solaire"
meta,"Lunette  Solaire BANHARTC3 coloris GRIS taille 47-20-145 matiere combinée"
title,VSBLAKE-ZOLC3
meta,"Lunette  Solaire BLAKEC3 coloris GRIS taille 51-21-146 matiere acétate"
